Research and Markets: Movies & Entertainment in the United States:#DUBLIN--(BUSINESS WIRE)--      Research and Markets (http://www.researchandmarkets.com/research/3clwfc/movies_and)      has announced the addition of the Movies      & Entertainment in the United States report to their      offering.          Movies & Entertainment in the United States industry profile provides      top-line qualitative and quantitative summary information including:      market size (value 2007-11, and forecast to 2016).          The profile also contains descriptions of the leading players including      key financial metrics and analysis of competitive pressures within the      market. Includes market size data, textual and graphical analysis of      market growth trends, leading companies and macroeconomic information.     Highlights       - The movies & entertainment market consists of both producers and      distributors of entertainment formats, such as movies and music. The      movie box office segment is valued as the revenues received by box      offices from total annual admissions. The home video segment covers      sales of Blu-Ray, DVDs and VHS at end-user (retail) prices including      paid video downloads. The music segment is valued as the revenues      accruing from the sale (at retail prices) of recorded music in any      physical or digital format, but excludes revenues from live      performances. Any currency conversions used in the creation of this      report have been calculated using constant 2011 annual average exchange      rates.          - The US movies & entertainment market had total revenues of $29.6      billion in 2011, representing a compound annual rate of change (CARC) of      -5.5% between 2007 and 2011.          - Video sales were the most lucrative for the US movies & entertainment      market in 2011, with total revenues of $11.5 billion, equivalent to      38.9% of the markets overall value.          - The performance of the market is forecast to decline further but with      a slower pace, with an anticipated CARC of -1.6% for the five-year      period 2011 - 2016, which is expected to drive the market to a value of      $27.3 billion by the end of 2016.     Key Questions Answered       What was the size of the United States movies & entertainment market by      value in 2011?          What will be the size of the United States movies & entertainment market      in 2016?          What factors are affecting the strength of competition in the United      States movies & entertainment market?          How has the market performed over the last five years?     For more information visit http://www.researchandmarkets.com/research/3clwfc/movies_and
Facebook is facing a level of uncertainty it hasn’t seen#Facebooks ability to manage its data scandal will ultimately determine its long-term future, according to Goldman Sachs.Facebook was the worst-performing stock in the S&P 500 on Monday, posting its biggest one-day decline since March 2014. This followed reports over the weekend that political analytics firm Cambridge Analytica was able to collect data on 50 million peoples profiles without their consent.The London-based company worked on Facebook ads with the Trump campaign, providing details on American voters.Facebook has come under fire for its role in the scandal and has been accused of mishandling users data. It certainly introduces a level of uncertainty that we havent seen with Facebook before, Heath Terry, lead internet research analyst at Goldman Sachs, told CNBC on Tuesday.Terry said every fast-growing tech giant was likely to face a similar crisis, such as the so-called click fraud scandal that threatened Googles growth prospects in recent years.Thats going to be the same here for Facebook. Its going to be how they manage through this that will ultimately determine their long-term future, Terry said.
Meet Rashida Tlaib and Ilhan Omar, the first Muslim women#Rashida Tlaib and Ilhan Omar made history last night. The two are the first Muslim women elected to serve in Congress.Tlaib, who ran unopposed after securing the Democratic nomination in August, won in Michigans 13th Congressional District, and Omar, who faced Republican Jennifer Zielinki, won in Minnesotas 5th Congressional District.Following the win, Omar took to Twitter to congratulate Tlaib on her victory and to acknowledge the history they made.TwitterTlaib, who was born to Palestinian parents, first made history in 2008 when she became the first Muslim woman to be elected State Representative. From 2009 to 2014 she served in the Michigan House of Representatives, where she helped secure millions of dollars for free health clinics, Meals on Wheels programs for seniors and before and after school education funding, according to her campaign website.
US job cuts soar, thanks to tech layoffs: Challenger#U.S. employers planned to cut nearly 50,000 positions in July, Challenger, Gray & Christmas reported Thursday, meting out 50 percent more job cuts than in the prior month.The global outplacement firm said in its monthly layoff report that planned payroll reductions hit 46,887, the second highest level of the year. That compares with Junes 31,434 cuts, which were the fewest of 2014. The firm added that massive staff reductions by Hewlett-Packard and Microsoft helped inflate this months figure.To date, employers have announced 292,921 job cuts, a level slightly below the comparable year-ago period, Challenger reported.   —By CNBC.com
FOREX-Dollar firm vs yen and euro before U.S. jobs data#* Upbeat U.S. private payrolls data boosts dollar* Yen hampered by Japans trade deficit, economic woes* Euro has been hit by Greek court ruling on austerity stepsLONDON, Nov 2 (Reuters) - The dollar rose to a near four month-high against the yen on Friday as investors bet on an upbeat U.S. payrolls report after private employers added jobs at the fastest pace in eight months. The euro fell to a three-week low against the dollar on selling by long-term investors. The euro has also been under pressure since a Greek court ruled on Thursday that pension reform demanded by foreign lenders may be unconstitutional. That raised concerns about Athens ability to implement the austerity measures needed to secure bailout funds. All these drove the dollar index to a seven-week high of 80.389, breaking above its 55-day moving average of 80.14. The dollar was up 0.2 percent on the day at 80.31 yen, just shy of last weeks four-month high of 80.38. Traders reported an option barrier at 80.50 yen with hedge funds ready to buy the dollar on dips if the U.S. jobs numbers disappointed. A break of resistance at 80.60-65, a chart triple top marked between May and June and a 50 percent retracement of the dollars March to September decline, could signal further gains. ``A good U.S. jobs number will no doubt give a leg up to dollar/yen, said John Hardy, currency strategist at Saxo Bank. ``From a medium-term view, we are bullish on dollar/yen and the pair has established a base around 79 yen for a rally to 88 yen in a years time, he said. The yen has come under pressure because recent Japanese data and corporate earnings have been soft. Third-quarter economic output data, due on Nov. 11, is also likely to have contracted. Payrolls processor Automatic Data Processing said private employers added 158,000 workers last month, bolstering expectations that the non-farm payrolls report due at 1230 GMT may beat forecasts. A Reuters poll forecasts a rise of 125,000 U.S. non-farm payrolls in October. The unemployment rate is seen ticking up to 7.9 percent. Any market reaction to the jobs data may be short-lived given the uncertainty of the outcome of Tuesdays U.S. presidential election.EURO ZONE STRUGGLES Some, however, are less sure about a sustained rise in the dollar as investors fret over the so-called ``fiscal cliff of looming tax rises and spending cuts in the United States. ``Over the course of the next month we would expect to move lower in dollar/yen, any upside above 81 would be surprising driven by U.S. negativity surrounding the fiscal cliff, said Christian Lawrence, currency strategist at Rabobank. The euro fell 0.4 percent to $1.2885, a three-week low, as traders sold the single currency, triggering an option barrier at $1.2880. Bids from Asian central banks and Middle East investors were cited below $1.2850. However, the euro held within the $1.2800-3200 range seen since September, underpinned by the European Central Banks pledge to buy bonds of indebted euro zone countries that seek aid. Signals in the option market showed the pair was likely to trade in a range in coming weeks. The one-month implied volatility on euro/dollar options fell to fresh five-year lows around 7.50 percent. Data on Friday showed peripheral euro zone countries were still struggling. Spains manufacturing sector shrank last month at it fastest pace since July, while Italian factory activity shrank in October for the 15th month running. Commodity currencies eased after rallying earlier in the day. The Australian dollar hit a five-week high of $1.0420 before giving up gains to stand at $1.0380 as caution set in before the U.S. jobs data. The currency was helped by Thursdays improvement in manufacturing data from China, Australias main export market.
Cortera Appoints Gary Brooks as Chief Marketing Officer#Industry veteran to accelerate growth and market awareness of B2B      Purchase Behavior        BOCA RATON, Fla.--(BUSINESS WIRE)--      Cortera®,      a provider of comprehensive business-to-business payment and purchase      data and insights for U.S. companies, announced Gary Brooks has been      named chief marketing officer (CMO).          Brooks brings more than 20 years of technology marketing experience to      Cortera where he manages the development and execution of the companys      marketing strategy. In this capacity, he focuses on expanding Corteras      leadership position and accelerating revenue growth through the      management of strategic positioning, branding, demand generation and      sales readiness.          Brooks most recently served as executive vice president of marketing for      Bomgar Corp., which provides secure remote support solutions for      businesses. Prior to that, he served in executive leadership roles with      Servigistics (acquired by Marline Equity Partners), KnowledgeStorm      (acquired by Tech Target), TRADEX (acquired by Ariba), Ariba, Fortress      Technologies, AltaVista (acquired by Compaq) and Digital Equipment      (acquired by Compaq).          Garys entrepreneurial spirit, results orientation and reputation for      scaling revenue makes him the perfect fit for Cortera as we gear up for      our next phase of growth, said Jim Swift, president and chief executive      officer at Cortera. Gary joins the company at a pivotal moment in its      history as leading companies increasingly understand how B2B purchase      behavior—what companies buy and how their spending changes over time—can      be used to dramatically increase revenue and reduce risk.”          “I’m thrilled to be part of an innovative organization that is enabling      companies to use B2B purchase behavior data to improve sales and      marketing effectiveness,” said Gary Brooks, CMO for Cortera. “Knowing a      customer or prospects’ propensity to buy a particular product enables      marketing and sales professionals to efficiently find new customers,      retain existing customers and maximize revenue from both.”          Brooks holds a bachelors degree from Northeastern University, a      masters degree from Lesley University and has been an active leader in      a variety of volunteer positions in the communities where he has resided.     About Cortera       Cortera is a provider of comprehensive business-to-business payment and      purchase behavior insights on public and private companies. The company      tracks $1.6 trillion in business-to-business purchases across 45 spend      categories to deliver insights on 20 million U.S. business locations.      Cortera’s solutions enable companies of all sizes to better understand      their customers, suppliers and business partners by gaining visibility      into what they purchase, how they pay and how their purchase and payment      behavior changes over time. Thousands of companies across diverse      industries use Cortera solutions to increase revenue, improve sales and      marketing effectiveness, and reduce risk. Cortera is privately held with      offices in Boca Raton, Fla.; Boston and Quincy Massachusetts and      Bangalore, India.
The Most Amazing Press Release Ever?#Funny Business readers know how I feel about press releases sent to me which are either far outside the field of business news (We are reaching out to gauge your interest in visiting the Caribbean island of Curaçao in 2011), or lacking pizzazz (Northrop GrummanDelivers 20,000th LN-200 Inertial Measurement Unit).Today, however, I discovered the most amazing press release ever, written by a man, an Apple, and a dog. PR professionals, take note. This is how to get attention. Click here to read The Most Amazing Press Release Ever.
WALL-E Cleans Up at Box Office#Animation giant Pixar scored its ninth consecutive No. 1 Sunday with its robot love story WALL-E, while Angelina Jolie achieved a personal best with her violent assassination thriller Wanted. WALL-E, bolstered by near-unanimous critical praise, sold an estimated $62.5 million of tickets in its first three days, said Pixars Walt Disney Co parent.It tied with 2001s Monsters, Inc. to become Pixars third-best opener.Pixar has gone to No. 1 with all nine of its movies, an unprecedented run that begin in 1995 with Toy Story. The company record of $70.5 million was set in 2004 by The Incredibles. Industry pundits had forecast an opening for WALL-E in the $50 million to $60 million range.Anything north of 60 (million dollars), we were going to be ecstatic, said Mark Zoradi, president of Walt Disney Studios Motion Picture Group .Meanwhile Jolie, whose career has been overshadowed in recent years by breathless tabloid coverage of her personal life, kicked off at No. 2 with Wanted. The Universal Pictures release earned about $51.1 million, easily beating forecasts of an opening in the mid- to high-$30 million range.Her previous record for a live-action movie was 2005s Mr. & Mrs. Smith, which opened to $50 million.The General Electric Co-owned studio  said Wanted ranks as the third-highest opening for an R-rated action film, behind The Matrix Reloaded ($91.7 million) and 300 ($70.9 million).SALES SOAR WALL-E and Wanted, clearly aimed at disparate audiences, helped pushed overall sales to their highest level of the year, said tracking firm Media By Numbers.The top 12 films grossed $179 million, up 29 percent from last weekend, and up 20 percent from the year-ago period, when Pixars Ratatouille opened at No. 1 with $47 million on its way to $206 million.Last weekends champion, the Warner Bros spy comedy Get Smart, slipped to No. 3 with $20 million, taking its 10-day haul to $77.3 million.The film, which stars Steve Carell as the inept hero Maxwell Smart, should finish up with about $130 million, said the Time Warner Inc-owned studio .Rounding out the top five, Pixar rival DreamWorks Animation SKG Incs Kung Fu Panda slipped one to No. 4 with $11.7 million, taking its total to $179.3 million.The film opened four weeks ago to $60.2 million.Marvel Entertainment Incs The Incredible Hulk fell three to No. 5 with $9.2 million.The superhero adaptation has earned $115.5 million after three weeks, roughly on par with its unloved 2003 predecessor The Hulk. WALL-E, a space adventure mixing an unusual love story with somber messages about the future of Earth and humankind, was directed by Andrew Stanton, who won an Academy Award for Pixars 2003 hit Finding Nemo. The title character, or Waste Allocation Load Lifter Earth-Class, is the last of a cadre of robots tasked with cleaning up piles of trash discarded by humans who abandoned the planet centuries before.The human race set off on a luxury space cruise during a planned five-year clean-up that lasts much longer and results in unfortunate changes in the human physique and psyche.The arrival of a sleek girl robot named Eve, sent to Earth by the orbiting humans to look for plant life, sends Wall-E on an adventure that changes his own and humanitys destinies.Critics heaped praise on the film.According to Rotten Tomatoes, a Web site that collects reviews, an astonishing 96 percent of critics liked the film.Michael Phillips of the Chicago Tribune said on TVs Ebert & Roeper that it was perhaps the best American studio picture of the year, but the Hollywood Reporter said it might be too clever to connect with mainstream audiences. Disneys Zoradi said WALL-E was not a conventional cartoon, but the studio was confident from the get-go that it would work.He declined to reveal the films budget, in line with Disneys policy.WALL-E also opened at No. 1 in six small foreign markets, led by Brazil with $1.6 million, Zoradi said.It will reach Russia and Mexico next weekend, followed by the U.K. in mid-July, timed with the school holidays in each market.Wanted, a $74 million comic book adaptation directed by Kazakhstan-born filmmaker Timur Bekmambetov, stars Scottish actor James McAvoy (The Last King of Scotland) as an office drone recruited to an elite order of assassins by Jolie and Morgan Freeman.Critics were also enthused.______________________________An earlier version of this story had outdated box office information.
What to make of the Fed minutes: El-Erian#The minutes released Wednesday by the Federal Reserve are a must-read for those interested in the complexity of modern central banking—if only for the striking contrast between the milquetoast discussion of the economy and the many policy and market complexities.    There is little that is new or noteworthy in the sections on economic developments and prospects. The bottom line is also a repeat of what has characterized many post-global financial crisis minutes: a more muted immediate economic outlook (growth and inflation) coupled with somewhat greater optimism for the longer term—all on a baseline characterized by the usual references to modest, moderate and cautious.   By continuing the practice of compensating for a somewhat softer short-term outlook with upward adjustments thereafter, the FOMC is sidestepping an issue that has now entered the mainstream lexicon with a bang because of recent remarks by Larry Summers and Paul Krugman. Its whats being called secular stagnation and what Pimco in 2009 labeled the new normal—namely, a prolonged period of low growth and persistently slow job creation.    The minutes rather subdued economic discussion contrasts with the large number of open policy (and therefore market) questions.    (Read more: Fickle Fed: Taper could arrive in coming months)   From the interaction between the two main tools (asset purchases and forward policy guidance) to the consideration of new ones (lowering IOER), and from how and when to taper to the best way to communicate with markets, the minutes paint a truly complicated policy mosaic. Further, it is one that is still in the making and whose ultimate shape—and therefore impact—is subject to considerable uncertainty.   The complexity also extends to the specification of the intermediate policy targets that are so crucial for fine-tuning the policy response and thus delivering desired outcomes. Specifically, Fed officials posed the legitimate question of whether the commonly followed unemployment rate overstates the improvement in the labor market and, probably more controversial, whether it makes sense to add an inflation floor.    Finally, the minutes suggest that this is a Fed that is contemplating not only what could go right if it continues on the current policy path but also what could go badly wrong.    For this reason, officials considered scenarios under which it might, at some stage, be appropriate to begin to wind down the program before an unambiguous further improvement in the economic outlook was apparent. Why? Because of concerns about the efficacy or costs of further asset prices.    Such complexity can paralyze market participants at a time when the Fed in particular and central banks in general continue to play an important role in asset price determination. Yet some aspects are less ambiguous.   (Read more: Good news: Bubble concern is at a five-year high)   Taken in their entirety, the minutes provide further support for a consequential hypothesis: As part of a forthcoming policy evolution, the Fed wishes to encourage markets to delink their assessment of the two main policy tools—thereby enabling Fed officials to strengthen forward policy guidance, reduce (very gradually and carefully) heavy reliance on balance sheet operations and avoid a repeat of the May-June disruptions to the functioning of markets.    Fed officials may even be tempted into cutting IOER as a way to help manage this tricky and uncertain policy pivot.  (Read more: Yellen must promote strong recovery)   This is the reason why Pimco stresses greater differentiation in portfolio positioning.   We have been favoring the front end of interest rate curves while shying away from the long end—a point that my colleague, Bill Gross, has stressed repeatedly in his writings and tweets. It is also why, given current price levels, we feel that risk assets are becoming consequentially more dependent on a proper recovery in fundamentals and not just continued policy support.    And it is why we believe that greater attention should be devoted to recent disparities in performance among and within some major asset classes.   (Read more: Op-ed: Taper or not, expect higher rates)  — By Mohamed El-Erian  Mohamed El-Erian is the CEO & co-CIO of Pimco. Follow him on Twitter @pimco.
Fragmented UK would be bad for debt ratings, says Fitch#Britains impending exit from the European Union (EU) as well as the potential breakaway of Scotland would be a bad scenario, according to the global head of sovereigns at Fitch Ratings.A fragmented U.K. is a bad scenario from a ratings perspective because it would raise the debt-to-GDP (gross domestic product) of the remaining U.K. government by somewhere around 8 to 10 percentage points of GDP, warned James McCormack, speaking to CNBC on Wednesday from the IIF G20 summit in Frankfurt.Last time there was a referendum we talked a lot about this, said there were potential negative ratings implications, the same would be true this time, added McCormack, the executive with chief responsibility for countries debt ratings.The Fitch executive highlighted that following the triggering of Article 50 to initiate the Brexit process - widely signaled to happen before the end of this month - all parties involved will be facing the great unknown in terms of how the decoupling of the U.K. from the trading bloc plays out.I think from the U.K.s perspective they want to get as many things started as possible. From the European perspective, they want to go nice and slow and do things in the proper order, he opined.This weeks confirmation that Scotlands First Minister, Nicola Sturgeon, would seek to hold another referendum before the spring of 2019 asking her compatriots whether they would like to split off from the rest of the U.K., simply added a further twist to the complicated path ahead for the U.K. government, McCormack said.While a lack of clarity over when exactly such a vote would be held was additionally unhelpful, the reality is that it would be difficult for the U.K. government no matter what the timing.A lot of political capital is going to be required on both fronts, he added.
Britains May sets out Brexit vision for trade deal deeper#British Prime Minister Theresa May set out her vision on Friday for a Brexit deal deeper and wider than any free trade agreement in the world, telling the European Union it is in their shared interest. Below are the highlights from her speech and a follow-up question-and-answer session with reporters:
Morgan Stanley earnings, revenue top expectations#Morgan Stanleys third-quarter revenue jumped  50 percent, helping adjusted earnings beat expectations, as  higher income from equities sales and trading made up for a  drop in the Wall Street bank and brokerages fixed-income  business.  Morgan Stanley reported net income of $888 million, or 44 cents  per share, from continuing operations in the quarter. That  compared with a loss of $1 billion, or 55 cents per share, a  year earlier.  The year-earlier figure included a charge of $2.3 billion to  reflect a rise in the value of Morgan Stanleys debt.
Moodys lowers outlook on Amazon to negative#Moodys Investors Service cut its outlook on Amazon.com from stable to negative on  Monday, prompted by the online retailers announcement that it was  issuing new debt.   The credit rating agency also affirmed the companys Baa1 senior unsecured rating.Following the news, Amazon stock dropped more than 3 percent.
