Santoli’s Wednesday market notes: Could September’s stock shakeout tee up#This is the daily notebook of Mike Santoli, CNBCs senior markets commentator, with ideas about trends, stocks and market statistics.
My take on the early Brexit winners and losers#"This commentary originally ran on Facebook. Boris Johnson – The former London mayor and grudging Leave supporter-turned enthusiastic Leave leader chose the winning side. Hes now a front-runner to lead the Tory party. ‪‎HellFreezesOver‬ Theresa May – Boris Johnsons populist approach to the Brexit campaign ticked off quite a few Tory elders, so the real money should be on UK Home Secretary Theresa May to succeed outgoing Prime Minister David Cameron. May is a political heavyweight and is generally respected among the Tories, something Boris Johnson is … um, not.  Nigel Farage – the once-embattled UK Independence Party leader gets his moment in the sun. Also gets to keep having a political career. And the fact that he quoted Independence Day in his victory speech made a crazy night that much crazier.  Marine Le Pen/Geert Wilders – Charismatic figures with a long history agitating for EU exits, Frances Marine Le Pen and the Netherlands Geert Wilders wasted no time calling for their own referendums. Brexit legitimizes their years of saber-rattling, and moves them from the political fringes into the mainstream, where they can do serious damage to the European project.  Vladimir Putin – Russias strongman needed this. Low oil prices have leveled the Russian economy, and the International Olympic Committee has banned Russian track athletes from competing at ‪‎Rio2016‬. But now he gets to say at least were not Europe.  Nicola Sturgeon – The head of the Scottish National Party delivered on her end from Scotland, where 62 percent of Scots voted to Remain, though turnout wasnt as high as hoped. She now has political leverage by threatening to hold another Scottish referendum. And if Scotland leaves, the British drought at Wimbledon gets retroactively reinstated.  German/US relations – Going to get stronger. By default.  David Cameron – The man called the referendum to keep Euroskeptic Tories from defecting to the UK Independence Party camp in last years parliamentary election. That turns out to have bought him an extra year in 10 Downing Street. Hope it was worth it, David. ‪‎KarmaIsABitch‬   British pollsters – whiffed on the Scottish referendum. Whiffed on last years parliamentary elections. Whiffed on the Brexit referendum. We were better off flipping a coin.   Alexis Tsipras – when the Greek Prime Minister held a referendum on whether the Greek people should sign a deal for more austerity, he just ignored the results. The fact that Cameron actually fell on his referendum sword makes Tsipras look silly. Oh, and Grexit is now a real possibility now that the precedent has been sent. Labour Party Leader Jeremy Corbyn – Pundits have pointed to Labours particularly poor showing to get out the vote as a key reason why the Remain side failed to win. And Jeremy Corbyn just failed in his first real test as Labour leader. Labour has some soul-searching to do, though it feels like we say that after every election.  German Chancellor Angela Merkel – Brexit is now yet another problem for Europe (read: Merkel) to deal with. As if she didnt have enough to worry over.   The British pound sterling – As the pound fell to levels not seen since 1985, maybe the first time ever that the British wish they had adopted the euro.   Londons financial sector – Despite the UKs long-fraught relationship with the EU, it was clearly a net benefit for Londons financial sector, which could lay claim as the financial center of Europe. Much harder to do that when youve announced to the world you no longer want to be part of Europe. Look for Frankfurt to pick up the slack.   Donald J. Trump – Would have made him a winner, except he arrived in Scotland and announced that the Scottish took their country back. So many things factually incorrect in that one statement I dont even know where to begin. Still, Brexit shows that divisive politics has an audience, which could bode well for The Donald.  Commentary by Ian Bremmer, the president and founder of Eurasia Group. He is also a professor at New York University and the author of Superpower: Three Choices for Americas Role in the World. Follow him on Twitter@ianbremmer.  For more insight from CNBC contributors, follow 

@CNBCopinion

 on Twitter."
Europe&039;s recovery depends on Renzi&039;s Italy#In spring, ambitious reforms began in Italy. Under Matteo Renzi, the ailing economy will either begin a real recovery, or slide further. The outcome is vital to Italy, Europe and the global economy.   Soon the name of Matteo Renzi, the new prime minister of Italy, will be known better internationally, after his meetings with German Chancellor Angela Merkel and President Obama.    Along with French President François Hollande, the two know only too well whats at stake in Italys recovery. If it succeeds, the recovery of the euro zone will slowly continue. If not, the implications will be global. The reform drive of il Rottamatore   One year after being sworn in as Mayor of Florence in 2009, Matteo Renzi declared that a complete change was necessary in his Democratic Party and Italian politics. So he was nicknamed il Rottamatore (The Scrapper). Last February, the 39-year-old Renzi became the youngest person in history to be Italys Prime Minister — even younger than Mussolini.   (Read more: France to ply China with wine)   But can the Great Scrapper reverse Italys economic decline?   First, the good news: In the end of 2013, only two months before Renzi arrived in Rome, the longest recession in Italys postwar history ended.    The bad news is that, after nine consecutive quarters of negative growth, the economy is almost 10 percent smaller than before the crisis. Meanwhile, business continues to complain about the tax burden, and the unemployment rate has doubled to over 12 percent since 2007. Despite pledges of austerity in Brussels and Rome, Italys fiscal deficit is 3 percent of the GDP and its sovereign debt has climbed to more than 132 percent of the gross domestic product (GDP). Among the EU members, only Greece has more.    The only bright spot is the current account surplus, which is almost 1 percent of the GDP. The positive turn stems from a higher contribution from net exports, coupled with a decline in imports. Nonetheless, it will be hard for Italian exporters to sustain their performance in the near future.    The economy suffers from a de facto process of de-industrialization. Industrial production has not increased ever since August 2011 and is now down 25 percent from its peak. Credit contraction weighs heavily on business confidence and consumer sentiment.   Ambitious programs — on a monthly basis   Today, Renzis Democratic Party, Partito Democratico (PD), has its strongest constituencies in Northern-Central Italy and the big cities. PD runs 12 Italian regions out of a total of 20. It is social-democratic, progressive by outlook, reformist by inclination.    Renzi himself is perceived as a liberal modernizer. When he became prime minister, it was a sign of much-needed generational change in the aging Italy, in which potential growth amounts to barely 0.8  to 1 percent in the coming years.    (Read more: Russias next step: Capitol controls?)   Italy needs huge structural and institutional reforms. Renzi hopes to reverse the countrys longstanding decline by launching one large project every month, starting with a new electoral law to consolidate political decision-making, reforms in the public administration, and the tax system.    Even before Italys European Council presidency will begin on July 1, 2014, Renzi hopes to achieve on a monthly basis what Romes political class has failed to achieve in decades. After Berlusconis rule, he sees Italys political landscape as devastated. Even before his premiership, he suggested that Italys parliamentarians should vote for their own removal. To become prime minister, Renzi politically maneuvered his predecessor Enrico Letta to resign.    Nonetheless, Renzis program will initiate the long-needed transformation of Italy. If this program will fall apart, the failure could push the economy deeper into the abyss.   Slow recovery — or devastating depression   In the past, the euro zone avoided a major crisis as long as friction points were restricted to small economies (e.g., Greece, Portugal, Ireland), which each accounted for less than 3 percent of the euro zone GDP.    Everything changed in fall 2011 when the contagion effect reached Spain and Italy, which together account for almost 30 percent of the regional GDP. If, under these circumstances, Greece would have defaulted, it could have caused a contagion effect, particularly in Italy. That is why Greece has now received two bailouts (73 billion euros and 164 billion euros), is in talks about a third one (up to 20 billion euros) and more generous repayment terms.    As long as Greece remains solvent, Italy and Spain will have time to restore sustained growth.   (Read more: ECBs Weidmann says QE not out of the question)  The Italian economy remains vulnerable, however. Standard & Poors still has a negative outlook on the countrys BBB rating. Even by 2016, Italian economic output is likely to remain nearly 7 percent below 2007 levels. It is suffering from a lost decade.   The stakes are massive. Italy continues to account for 5 percent of gross commercial long-term debt globally, although its population is less than 1 percent of the world total.   While Brussels has demanded tough austerity programs, an exclusive focus on the latter would only make things worse in Italy. Instead, Renzis government is likely to reduce its huge debt only slowly, but focus on a lower deficit.    A failure to achieve progress would polarize Italy, destabilize Southern Europe and reduce global growth prospects.   How Italy goes, so will the world go.  — By Dan Steinbock  Dan Steinbock is research director of International Business at India China and America Institute (USA), visiting fellow at Shanghai Institutes for International Studies (China) and in the EU-Center (Singapore). See also www.differencegroup.net.
US Moves Closer to Becoming A Major Shareholder In GM#The US government is increasingly likely to convert a $13.4 billion loan to General Motors into common stock, sharply reducing the companys debt burden and giving taxpayers a major stake in the struggling auto maker, sources tell CNBC.
Chevron CEO Watson says he supports Trump on tax reform#Chevron Chief Executive John Watson told CNBC Tuesday that he strongly supports U.S. tax reform under President Donald Trumps administration. Trumps administration wants to make U.S. tax reform competitive, Watson said during an interview on CNBCs Closing Bell. Specifically he discussed a proposed bill — a border-adjustment tax — that could hike rates on American imports. Despite concerns that a border tax could hurt oil prices, Chevrons Watson said industry imports would come into balance over time. The unpredictable effects of the U.S. dollar strengthening is what concerns a lot of people, he explained.
22. Hexadite#Founders: Eran Barak, Barak Klinghofer (chief product officer), Idan Levin (CTO) Launched: 2014 Headquarters: Boston Funding: $10.5 million   The three founders of Hexadite, a Boston-based cybersecurity firm, have backgrounds in investigating and mitigating attacks for military intelligence units and global defense companies. They knew that these same kinds of automated cyberattacks were plaguing a wide variety of companies, leaving them unprepared when responding to a breach or, worse, preventing a future attack.Hexadite uses artificial intelligence to investigate and remediate every alert a company receives, claiming it can resolve incidents in seconds, freeing up a companys response team to focus on threats that truly need their expertise. Hexadites Automated Incident Response Solution platform can integrate with customers existing security technologies and can cut response time by 95 percent, the company says.Co-founder and CEO Eran Barak spent five years in an elite intelligence unit of the Israel Defense Forces before starting Hexadite in 2014 and was also head of Elbit Systems cybertraining and simulation team. Late last year the company formed an alliance with other cybersecurity companies across the country, including Carbon Black, Check Point Software Technologies and Hewlett Packard Enterprise, to better integrate their products and automate important security processes.The goal of the alliance, explains Barak, is to utilize software to lighten the workload of security teams so that they can focus their time on the most dangerous and complex threats. The company has raised $10.5 million in funding from investors, including Hewlett Packard Ventures and TenEleven Ventures.
European stocks close higher on supportive Fed; Signature Aviation skyrockets#LONDON — European stocks closed higher on Thursday as traders reacted positively to comments from the U.S. Federal Reserve that it will continue to support the economy.
Fewer investors have a fear of missing out, so it#Oppenheimer Asset Managements John Stoltzfus suggests investors may want to fasten their seat belts.The long-time bull expects a wave of near-term volatility to pressure stocks. Hes blaming uncertainty surrounding this weeks Federal Reserve decision on interest rates, another big batch of second quarter earnings results and a fresh round of U.S.-China trade talks.Any kind of disappointment in a sense, okay, I can kind of take profits today without FOMO [fear of missing out] gripping my soul, the firms chief investment strategist told CNBCs Futures Now last Thursday.With the fear of missing out gripping fewer investors, Stoltzfus contends its not the time to get aggressive.Were highly selective at this point with the S&P 500 up over 20%, he said.The index, which closed the week at new record highs, has already surpassed Stoltzfus year-end target of 2,860 by almost 6%. Hes planning to tweak the number once theres more visibility.Its under revision at this time. Were going to wait until after the Fed makes its decision on the 31st, he said At that point, well put in our new target for the year-end, depending on how that goes.Stoltzfus notes a more favorable development in the U.S.-China trade war would be an integral part of his bull case. He believes its the biggest headwind holding back stocks from ripping even higher.It would be confirmation that indeed the markets thought things werent so bad, were actually pretty good, he said.For now, Stoltzfus is bracing for a 3 to 4% pullback to strike stocks near term. Hed look to add cyclical names such as consumer discretionary, industrials, financials and technology on weakness.Tech looks like a great place to be because technology flows into all of the eleven sectors. Every business needs technology, Stoltzfus said.
Morgan Stanley Tries to Stave Off Ratings Cut#James Gorman, Morgan Stanley’s chief executive, has been in discussions with Moody’s in an attempt to maintain its credit ratings and stave off a downgrade that could diminish the bank’s ability to buy the rest of Citigroup brokerage Smith Barney, according to people familiar with the matter.
Consultant to Vampire Squid of Expert Network Firms Questioned by#We know that one of the principal focuses of the government in their investigation into insider trading in general—and into hedge funds in particular—are the so-called expert-network firms.
Average tax refunds are down 8.4% in the wake of#The first U.S. tax filing season under the overhaul that President Donald Trump signed into law at the end of 2017 got off to a slow start in the first week, with data released on Friday showing a significant drop in returns and refunds.According to the Internal Revenue Service, the total number of returns received in the week ending Feb. 1, 16.04 million, was down 12.4 percent from the week that ended on Feb. 2, 2018. Only 13.31 million returns were processed, down 25.8 percent from the year before. The average refund of $1,865 was 8.4 percent smaller than the average refund in the period last year.
Watch: Oaktree Capitals Howard Marks speak from the Context Summit#[The stream is slated to start at 3:45 p.m. ET. Please refresh the page if you do not see a player above at that time.]Oaktree Capital Management co-chairman Howard Marks on Wednesday will speak from the Context Summits Miami conference in Miami Beach, Florida.Marks is known for his prescient investment memos, which warned about the financial crisis and the dot-com bubble implosion. During the 2007-09 market meltdown, the longtime investor established an $11 billion distressed-debt fund aimed at buying the financial instruments of companies near or currently in bankruptcy, helping Marks deliver some of the best returns on Wall Street at the time.Oaktree Capital had $124 billion of assets under management as of September 2018, according to its website.Subscribe to CNBC on YouTube.
Guggenheim says solar sell-off is a buying opportunity and has#Renewable energy is poised to play an ever greater role as the world shifts away from fossil fuels, and the recent pullback in clean tech stocks presents a buying opportunity, Guggenheim said while initiating coverage on solar stocks.We believe that the shift to distributed energy generation and storage is a large, sustained phenomenon, and owning best-in-class companies makes sense, the firm wrote in a note to clients. We expect distributed solar installations to continue growing robustly, especially now that energy storage is becoming economically viable.Following a 140% gain in 2020, the iShares Global Clean Energy ETF has dipped 20% this year. The S&P 500, by comparison, has gained 12%.Guggenheim pointed to several possible factors driving the declines, including excessive valuations after 2020s record run, as well as slower-than-expected governmental policies. Other concerns include rising input costs, such as for steel and semiconductors, and higher interest rates.But given solars large and growing market, Guggenheim said the pullback is an attractive opportunity to pick up shares of quality names.
Eni Pays Dominion $4.76 Billion for U.S. Gulf Assets#Italian oil and gas company Eni has bought upstream assets in the Gulf of Mexico from Dominion Resources for $4.757 billion, Eni said in a statement on Monday.Eni said the acquisition would boost its production in the area to more than 110,000 barrels of oil equivalent per day (boepd) in the second half of 2007. In the period from 2007-2010, production from the new assets would average more than 75,000 boepd.Eni, Europes fourth-biggest oil company by market value, said included in the purchase were exploration assets for $680 million and said around 60% of he overall leases were operated.Through this transaction we reach the necessary critical mass for our activities in the Gulf of Mexico, Eni Chief Executive Officer Paolo Scaroni said in the statement.Eni is one of the few world oil majors which has been able to largely avoid a decline in output as it adds production both through acquisitions and as new fields come onstream.It has made several large acquisitions recently.Earlier this month it won with Italian utility Enel a $5.8 billion auction for assets formerly held by bankrupt oil firm YUKOS but they handed the bulk of the prize to Russian gas monopoly Gazprom.Eni agreed to buy a package of Congolese assets from Frances Maurel et Prom for $1.4 billion earlier this year and in March struck a deal to split a stake in one of those fields with Burren Energy.
Strategist Paulsen: Market bottom is not in#Jim Paulsen, chief investment strategist of Wells Capital Management, believes the stock market sell-off is not over.  Finding a bottom in the stock market may well be a fools game,  but that does not stop us fools from trying, Paulsen wrote to clients Tuesday. He added: In our view, a quick  recovery back near all-time highs would leave the stock market  with many of the same vulnerabilities that started the  correction. Consequently, we would not be surprised if the stock  market tests its correction low yet again and perhaps even fails  before reaching a final bottom.  Here is why he believes the market is vulnerable…
CDC says 28 blood clot cases, 3 deaths may be#CDC scientists say their investigation into a rare blood clotting issue linked to the Johnson & Johnson Covid-19 vaccine has identified 28 people who developed the potentially life threatening blockages — three of whom have died.The Food and Drug Administration and Centers for Disease Control and Prevention on April 13 asked states to temporarily halt using J&Js vaccine out of an abundance of caution while it investigated six women, ages 18 to 48, who developed cerebral venous sinus thrombosis, or CVST, in combination with low blood platelets within about two weeks of receiving the shot.They recommended resuming use of the shot 10 days later after the CDC determined that the benefits of the inoculations outweighed their risks.CVST is a form of thrombosis with thrombocytopenia, or TTS, which are blood clots with a low platelet count that puts patients at risk for a stroke. Platelets actually help the blood to clot.Read CNBCs latest global coverage of the Covid pandemic:FDA authorizes Pfizers Covid vaccine for kids ages 5 to 11 South Korea loosens restrictions in first step toward living with Covid-19  Florida sues Biden over contractor Covid vaccine mandateGlobal Covid cases and deaths rise for the first time in two months, WHO says Some 5% of unvaccinated adults quit their jobs over Covid vaccine mandates, survey shows
The world’s most powerful women are …#Forbes has leaned in, releasing its annual list of the worlds  100 most powerful women, looking largely outside the corporate  C-suite for its power players.   Weve taken a much more expansive, dynamic look at power, not  just traditional power roles such as running a corporation or  head of state, but also creative dynamic power, Moira Forbes,  president and publisher of ForbesWoman, told CNBC.   Money is always important to look at because it is a form of  influence particularly when youre looking at the size of a  global business, the impact it has, the size of an economy,  Forbes said. But also we looked at things like social  influence. Read More Why am I rich? Wealthy  women cite frugality, good advice  She cited Sheryl Sandberg, the chief operating officer  at Facebook, ranked ninth on the list, as an example,  noting Sandberg is a business leader, self-made billionaire and  uses her influence to drive dialogues on women in leadership  through her lean in campaign.
Banks within Wal-Mart stores collecting high fees#Wal-Mart has a reputation for offering shoppers low  prices, but a report in The Wall Street Journal found  that the independent banks it houses inside its stores levy some  of the highest bank fees, largely as a result of overdraft charges.  After analyzing federal filings, the publication found that last  year, the five banks that have the largest presence in the  discounters stores were among the top 10 domestic banks in  terms of income from fees as a percentage of deposits.  Those banks are Fort Sill National Bank, First Convenience Bank,  Academy Bank, Woodforest National Bank and City National Bank and  Trust Company.  Overdraft fees can be a big issue for people struggling financially, as accruing them over time makes it makes it difficult to get out of debt.  A Wal-Mart spokesperson told the Journal it plays no part  in operating the banks, but that it ensures theyre in line with  Wal-Marts philosophy of saving customers money.To read the full story, click here.
CA leaders propose $1B drought relief package#California Gov. Jerry Brown and state leaders unveiled legislation Thursday for a $1 billion drought relief package designed to help the state deal with ongoing dry  conditions.   This unprecedented drought continues with no signs yet of  letting up, Brown said in a release. The programs funded by the  actions announced today will provide direct relief to workers and  communities most impacted by these historic dry  conditions.Read More2014 California drought was bad. 2015 will be worseThe package would include funding for safe drinking water and infrastructure projects designed to help the state deal with dry weather.
Philippines Q1 GDP growth slows to 1.1% q/q#Philippines economic  growth halved in the first quarter from the previous three-month period as weak exports and  agriculture hurt overall output, the statistics agency said on  Thursday. The economy grew 1.1 percent in the first quarter,  below the 1.6 percent forecast in a Reuters poll, and slower than the upwardly revised  2.1 percent in October-December. From a year earlier, first quarter growth was 6.9  percent, picking up from 6.5 percent in the fourth quarter and stronger than a forecast  6.6 percent.   Follow CNBC International on Twitter and Facebook.
