These food company stocks are a better way to play#Wall Street still has an appetite for fake meat.Beyond Meat rose nearly 7% on Tuesday after J.P. Morgan upgraded the meat-alternative stock to an overweight rating, citing valuation after a pullback from its highs.However, Boris Schlossberg, managing director at BK asset management, isnt firing up the grill just yet.I think the way to play is actually through the retail stores, Schlossberg said Tuesday on CNBCs Trading Nation.Beyond Meat has risen over 500% since its early May IPO, but has dropped nearly 40% off its late July high.My favorite is actually Dunkin Donuts, which has been really highlighting Beyond Meat and the Beyond Egg sandwich very well and has also done a very good job merchandising, said Schlossberg. That stock has also been a very strong momentum stock, but I still think its the right way to play it because its done a very good end-around McDonalds and Starbucks, and I think it has some very, very strong momentum going forward.Ari Wald, head of technical analysis at Oppenheimer, agrees food retailers would be a better play.We would prefer the food servers over the food suppliers, and the restaurant industry in general is really broadly strong here when were talking about McDonalds, Starbucks, Wingstop, Dunkin Brands, Wendys and Restaurant Brands, thats what were looking for, those broad based themes, said Wald.All those names are outperforming the S&P this year, and Wald says Wendys is showing signs of relative strength.Our analyst recently raised his target to $24 after recent management meetings, and the charts are supportive to really classic breakout here, said Wald. The stock got through $18 in April, came back tested that breakout in August, now turning higher again, new high in this mixed market tape, we see that as a sign of relative strength.Wendys has soared 5% in the past week even as the S&P 500 has fallen 1%. It is up 32% in 2019.Disclaimer
Irene Wounding Weekend Box Office#Hurricane Irene and the closure of at least 1,000 theater locations along the East Coast is expected to put a dent in this weekends domestic box office.
Review: The 2019 Toyota Tundra pickup fails to impress#The full-size pickup truck market has never been hotter, with Fiat Chryslers Ram and General Motors Chevy duking it out second place in sales behind Ford. All three big American companies are constantly refreshing their lineups to cling to any advantages over the competition.Thats big trouble for Toyota, which hasnt completely redesigned its Tundra pickup since 2007. Its received a slew of updates and a large refresh in 2014, but sales have always lagged behind the big three in Detroit. In a segment of six, the Tundra is the fifth-place finisher, besting only Nissans Titan in sales.After a week with one, its not hard to see why. Its well built and isnt as pricey as the American trucks, but we still wouldnt recommend one.
Bowyer: Who Am I To Judge The Case For Global#Last week I was a guest on Larry Kudlow’s Saturday morning radio program (on WABC, New York). A man called the program and said that some of these surveys which claim scientific support for the global warming hypothesis, contained some decidedly unclimatolgical signatures from pediatricians, gynecologists or just about anybody else with a terminal degree. In other words the case against oil was a little slipperier than reported. “Gynecologists against drilling?”, I thought, “Seems like there must be some kind of conflict of interest here. I need to learn more.”
Health-care maze remains for undocumented immigrants#President Obamas executive order preventing the deportation of  up to 5 million undocumented immigrants wont preclude all of  them from getting affordable health coverage. But it remains to  be seen just how many will be presented with that option.   Even if a good amount do get insurance, the health, social  and economic costs from having the remaining immigrants  effectively locked out of health coverage will remain a problem,  say advocates and analysts.  And some of those  costs—including visits to  emergency rooms that arent paid by  insurance—could end up getting  passed along to the general public, they noted.  Undocumented immigrants, who currently comprise one in every six  people in the United States without health insurance, by 2017 are  projected to make up 1 in 4 such uninsured people, said Stephen  Zuckerman, co-director of the Health Policy Center at the Urban  Institute.  Zuckerman noted that its not because there will be more  undocumented immigrants without insurance. Instead, he said, its because there will be significantly more  currently uninsured people overall getting insured in the coming  years through Obamacare insurance plans and from Medicaid,  particularly in states that have expanded eligibility for  Medicaid to include more people.  But both those options will essentially be blocked to the people  subject to Obamas order last week, which lifts the threat of  deportation and will give those people the ability to work  legally in the U.S. Read MoreCat got your tongue,  HealthCare.gov?  The White House has indicated it will not allow such  undocumented people access to federal subsidies that help most  Obamacare enrollees afford policies sold on government-run  insurance exchanges. And those people will also be barred by  federal law from enrolling in Medicaid, the joint  federal-state program that covers poor people.
As it happened: China stocks stage late rally; up 4%#Squawk Box Live in Europe kept you up to date with Chinas stock markets, which staged a late rally Wednesday. This came as investors geared up for another bumper day of earnings and the conclusion of this months Federal Reserve monetary policy meeting.
Will Markets Fed Rally Continue?#The stock market rallied midday Wednesday following the Federal  Reserves announcement of more bond buying, but will it  continue?   This does look like its going to be a long-term prognosis,  OptionMonsters Pete Najarian said on Fast Money.  Specifically, the Feds bond-buying and continued low interest  rates would benefit the financial sector, he added.  The rally in stocks suggested that Washington lawmakers would  strike a budget deal to avoid the so-called fiscal cliff, which would trigger tax  hikes and automatic spending cuts on Jan. 1, Stephen Weiss of  Short Hills Capital said.  Youre looking for talk of a grand bargain at this point, he  said. Youve increased the risk dramatically to your portfolio  with the way the markets risen.  Rosecliff Capitals Mike Murphy said the midday pop in the  S&P 500 to 1,435 was  significant and set up for a new level of resistance at 1,450.  The Fed action signaled that it was safe to get back into stocks,  he added.   I think the market continues to rally.  Trader disclosure: On Dec. 12, 2012, the following stocks and  commodities mentioned or intended to be mentioned on CNBCs Fast  Money were owned by the Fast Money traders: Mike Murphy is  long AAPL; Mike Murphy is long TGT; Enis Taner is long GS; Enis  Taner is long AAPL 1X2 CALL SPREAD; Enis Taner is long GOOG PUT  BUTTERFLY; Enis Taner is long SPY PUTS; Enis Taner is short XRT**;  Pete Najarian is long AAPL; Pete Najarian is long BAC CALLS; Pete  Najarian is long INTC CALLS; Pete Najarian is long RIMM CALLS;  Pete Najarian is long SBUX; Pete Najarian is long FB; Pete  Najarian is long MSFT; Pete Najarian is long LLY; Steve Weiss is  long BAC; Steve Weiss is long JPM; Steve Weiss is long C; Steve  Weiss is long FXI. (**Corrected.)
Your first trade for Wednesday, January 15#The Fast Money traders shared their first moves for the market open.Tim Seymour was a buyer of the Russia ETF.Brian Kelly was a buyer of Freeport McMoRan.Karen Finerman was a seller of Apple calls.Guy Adami was a buyer of UnitedHealth. DisclaimerTrader disclosure: Tim Seymour is long AMZA, AMZN, AAPL, ACBFF, ACRGF, ALEF, ACB, APH, ARNA, BA, BABA, BAC, BTI, C, CARA, CCJ, CF, CGC, CLF, CNBS, CRLBF, CRON, CSCO, CWEB, CURLF, DAL, DIS, DVYE, EA, EBR, EDC, EEM, EMH, EUFN, EWM, FB, FDX, FIRE, FLWR, FXI, GE, GM, GOOGL, GTBIF, GTII, GWPH, HEXO, HK.APH, HRVOF, HVT, HYYDF, IIPR, INTC, ITHUF, JD, KERN, KHRN, KRO, KSHB, LABS, LEAF, LNTH, MAT, MCD, MJNE, MO, MOS, MPX, MRMD, NEPT, NKE, NRTH, OGI, OGZPY, ORGMF, OTC, PAK, PCLO, PHM, PKI, RIV, SBUX, SNDL, SQ, SSPKU, STZ, T, TCEHY, TER, TGOD, TLRY, TNYBF, TRSSF, TRST, TWTR, UA, UAL, VEON, VFF, VIAB, VIVO, VOD, WAB, WB, WMD, X, XLY, YCBD, YNDX, ZENA, ZYNE, 700. Tim is short IWM, RACE, SPY. Tims firm is long CGC, HEXO, CRON, APH. Tim is on the advisory board of KSHB, Heaven,Tikun Olam, CCTV, and Canndescent. Tim has securities licenses registered with The Benchmark Company. Tim is an advisor to JWAM. Brian Kelly is Long Bitcoin, Ethereum, Oil, GLD. Short US 10 Year Notes. Karen Finermans firm is long ANTM, C, CBS, CPRI, FB, FDX, FL, FNAC, GOOG, GOOGL, GLNG, GMLP, HD, JPM, LYV, REZI, RRGB, SPY puts, SPY put spreads, STNG, TBT, TGT, TIF, URI, WIFI. Her firm is short HYG, IWM, LQD. Her firm is short TGT calls. Her firm is long DIS call spreads. Karen Finerman is long AAL, AYR/CN BAC, BOT Bitcoin, Bitcoin Cash, Ethereum, C, CAT, CBS, CPRI, DAL, DVYE, DXJ, EEM, EPI, EWW, EWZ, DVYE, FB, FL, GM, GMLP, GLNG, GOOG, GOOGL, JPM, LOW, LYV, KFL, MA, MTW, REAL, REZI, SEDG, TACO, WIFI, WFM. KarenFinerman is longFB spread calls. KarenFinerman is long GOOG put spreads. Karen Finerman is long SPY puts. Bitcoin and Ethereum are in her kids Trust. Guy Adami is long CELG, EXAS, GDX, INTC. GuyAdamis wife, Linda Snow, works at Merck.
Cramer’s Sell-Off Playbook#As horrible as they may seem, sell-offs are inevitable, Cramer said. But instead of panicking when a downturn happens, investors should see opportunity.There’s always a bull market somewhere, and there are opportunities in every market. That’s especially the case during a correction because stocks go on sale when the market drops. So instead of gnashing their teeth for not sidestepping a sell-off – an “amateurish pipedream,” Cramer called it – investors should take the chance to buy great companies on the cheap.This is why Cramer recommended having at least 5% of a portfolio in cash. So investors are ready when it’s time to pounce. If stocks have had a bigger run than usual, meaning some type of correction could be coming, 10% might be better. The bottom line: Big declines will always happen. But smart investors with readily available cash can take advantage of them.Questions for Cramer? Questions, comments, suggestions for the Mad Money website? madcap@cnbc.com
Powerful and dangerous Hurricane Ida is on the verge of#Hurricane Ida was on the verge of making landfall in the United States on Sunday as an extremely dangerous Category 4 storm that could plunge much of the Louisiana shoreline underwater as the state grapples with a Covid-19 surge already taxing hospitals.Ida gathered more strength overnight, faster than meteorologists had predicted only a day ago. It is the toughest test yet for the hundreds of miles of new levees built around New Orleans after the devastation of Hurricane Katrina, which made landfall 16 years ago to the day, inundating historically Black neighborhoods and killing more than 1,800 people.Louisiana Governor John Bel Edwards said that the storm, due to make landfall by Sunday afternoon, could be the states worst direct hit by a hurricane since the 1850s.The state is also dealing with the nations third-highest rate of new COVID-19 infections, with about 3,400 new cases reported on Friday alone. Hospitals were treating some 2,450 COVID-19 patients, Edwards said, with those in many of the states parishes already nearing capacity.By early Sunday, Ida was a Category 4 hurricane on the five-step Saffir-Simpson scale, the National Hurricane Center (NHC) said. At 11 a.m. CDT (1600 GMT) it was located about 60 miles (95 km) west-southwest of the mouth of the Mississippi River, and some 85 miles (135 km) south of New Orleans, carrying top sustained winds of 150 miles per hour (240 km per hour).Rain gusted through New Orleans on Sunday morning, where retired 68-year-old Robert Ruffin had evacuated with his family to a downtown hotel from their home in the citys east.I thought it was safer, he said. Its double trouble this time because of COVID.IDAs landfall was only a few hours away, according to the NHC, which warned of life-threatening storm surges, potentially catastrophic wind damage and flooding rainfall.Were as prepared as we can be, but were worried about those levees, said Kirk Lepine, president of Plaquemines Parish on the states Gulf Coast.Plaquemines is one of the most vulnerable parishes, where 23,000 people live along the Mississippi delta stretching into the Gulf. Lepine feared levees along Highway 23 were not up to task.Water could go over top, he said. Thats our one road in and out.Edwards told CNN on Sunday that he believed the states levees would be able to withstand the storm surge, though he expressed some doubt about parishes, like Plaquemines, in the south.Where were less confident is further south where you have other protection systems that are not built to that same standard, he said. Thats where we are most concerned about the impact of storm surge.He said on Saturday there were no plans to evacuate patients from hospitals, and that state officials had been speaking with hospitals to ensure their generators were working and that they had more water on hand than normal.Officials ordered widespread evacuations of low-lying and coastal areas, jamming highways and leading some gasoline stations to run dry as residents and vacationers fled.This is a powerful and dangerous storm. It is moving faster than we had thought it would be, so we have a little less time to prepare, said Dr. Joseph Kanter, Louisianas chief medical official. There is a lot of Covid out there, there are a lot of risks out there.
When you can expect to receive the $600 stimulus check#Now that President Donald Trump has signed off on the $900 billion coronavirus relief bill, many Americans can expect to receive a second stimulus check in the coming weeks, a welcome development for households across the country that could not afford to celebrate this holiday season.As of last week, direct deposits from the IRS were expected to hit bank accounts before Dec. 31, with paper checks and debit cards sent out to all eligible households by Jan. 15. But with the presidents delay in signing the bill, the payments may take slightly longer to arrive.Dont miss: The best 0% APR credit cards with no interest for up to 20 monthsThat said, it is possible that direct deposits could still start being deposited under the same timeline, as soon as this week, according to a spokesman for Rep. Don Beyer, D-Va., since the Treasury Department was already preparing to make the payments under the assumption that the bill would be signed last week.Treasury did not immediately return a request for comment, but an official told CNBC that the timeline is expected to be the same.
The Feds economic forecasts are all over the map, a#The Federal Reserves economic outlook isnt so much pessimistic as it is uncertain, with expectations running a wide gamut from a plodding recovery to a sharp rebound.If that sounds a lot like the market lately, its probably not a coincidence.Following its two-day meeting earlier this week, the Fed released its Summary of Economic Projections for GDP, unemployment, inflation and interest rates. The estimates largely reflected the current unprecedented downturn followed by expectations for varying levels of growth ahead. Specifically on GDP, which measures goods and services produced and is the broadest yardstick for economic growth, the median figures in each of the three years for which estimates were provided masked wide disparities of views from the policymaking Federal Open Market Committees 17 members.For 2020, the median expectation was for a GDP decline of 6.5%. But that was merely the midpoint of forecasts that ranged all the way from -10% to -4.2%. The difference gets even more pronounced in 2021, where the median is a 5% gain but the range goes from -1% — in essence, a continuation of the recession that started in February 2020 — to a 7% gain, which would be the fastest one-year growth rate since 1984.The outlook for unemployment and inflation all showed a substantial disparity of opinions.
With bitcoin ticking over $28,000, now might be a good#Sitting on a growing bitcoin fortune? Consider giving away some of it to charity.As 2020 draws to a close, the cryptocurrency has seen a massive surge in appreciation. The value of a single unit of bitcoin is now hovering around $28,000.Though longtime holders of the virtual currency are rejoicing, they run the risk of winding up overweight in bitcoin. That is, the massive run-up in values could suddenly result in investors having more exposure toward bitcoin — and its risks — than theyd like.Similarly, while cashing out of your holdings might seem attractive, it could come with a hefty capital gains tax bill on the appreciation.More from Advisor Insight:How financial advisors say to use your $600 stimulus checkHeres whos likely eligible for a second stimulus checkCovid relief bill adds PPP tax breaks the Treasury opposedThats where charitable giving comes into play.We believe in asset diversification, and because the price of bitcoin rose significantly, investors could be overallocated based on their targets for their portfolio, said Stefan Podvojsky, senior vice president of Fidelity Charitable.A donor advised fund provides a great outlet to remove that overweight and support the philanthropy that is important to the donor, he said.Indeed, investors in bitcoin have been able to donate their holdings to donor-advised funds via Fidelity Charitable since 2015.
MARKET EYE-Indian shares extend falls; Infosys, financials hit#* The BSE indexfalls 0.66 percent while the 50-shareNSE indexis down 0.56 percent heading to their firstweekly fall after five weeks of straight gains.* Shares in Infosys Ltddrops 5.5 percent afterdisappointing investors with weaker-than-expected margins andtook a conservative view on its full-year earnings.* Fears of high inflation data due on Monday is also leading totrimming of positions in financials ahead of the weekend.* ICICI Bankfalls 1.3 percent, while HousingDevelopment Finance Corporationis down 1 percent.* However, HDFC Bank, gains 1 percent after meetingforecasts with a 30 percent year-on-year rise in second quarterprofit.(abhishek.vishnoi@thomsonreuters.com)
Bitcoin could be used to hide assets in divorces, warn#Bitcoin, the electronic currency, could be used by  divorcing spouses to hide assets from estranged partners, lawyers  have said, as court battles shift their focus to the disclosure  of assets.  Divorce settlements in England are seen as particularly generous  to ex-wives, because judges recognize the equal contributions  made by the breadwinner and the homemaker in a marriage, and  divide the assets equally.  Moreover, courts are increasingly having to deal with legal  battles brought by one side claiming the other has not made full  disclosure of assets and has concealed wealth. Read MoreMarc Andreessen in bitcoin for  the long run  Ayesha Vardag, a London divorce lawyer, has warned that more  lawyers may start including digital currencies in financial  disclosure orders if there is evidence they have been used.  They can be used to run a parallel economy, she said. People  will go to immense lengths . . . as a spousal  claim is more damaging than tax because it is half your wealth.  Already, a number of forums devoted to Bitcoin discussion have  seen husbands exploring the option of using digital currencies,  she said.Read MoreDish to becomelargest company to accept bitcoin  Bitcoins provide relative anonymity to investors and, unlike bank  accounts and share holdings, they are hard to link to an  individual.  For this reason, the currency has become a mainstay of illicit  transactions, such as through Silk Road, the now-closed online  drugs and weapons marketplace.  Although traditional currency holdings – in US dollars or  euros for example – might need to be declared as part of the  asset disclosure process, parties could try to hide their wealth  by converting it to Bitcoins.
How traders cashed in big on the GE deal#Some savvy traders stand to make millions off Fridays General Electric deal as a result of some  very well-timed options trades.   On Thursday, when GE stock was trading around $25, traders  starting aggressively buying the April 26-strike calls for around  33 cents each. A call purchase is a bullish bet that a stock will  rise a certain amount within a set time. All told, nearly  18,000 of those calls traded. GE shares rallied 8 percent Friday  after the company announced it will sell its finance arm and buy  back stock. With the advance, those call options are now worth $2  each, a sixfold increase that created an instant windfall for the  buyers.
Here are the top 10 major worries for global business#Cybersecurity, health of the global economy, energy price shock and terrorist attacks are some of the top risks that concern businesses and may threaten their ability to operate, according to results from a new survey by the World Economic Forum (WEF) published Wednesday.The survey, conducted annually by the WEFs strategic partners Marsh & McLennan Companies and Zurich Insurance Group, highlighted the following ten risks that businesses are presently concerned about:While concerns about the overall health of the global economy continue to dominate the list, the report found concerns around cybersecurity risks rising in importance.Business leaders in many of worlds largest economies now rank cyber as their top risk, John Drzik, president of Marsh Global Risk & Digital, said in a press statement. Companies need to rigorously analyze how these threats could impact their operations and take appropriate risk mitigation and resiliency measures.
Wal-Mart A Year Later: High Prices Now Bring In Customers#A year ago Wal-Mart management said that high gas prices were hurting their customers and store sales.Now, a year later, gas prices are even higher and Wal-Mart management says those expensive costs are bringing customers into its stores. So I asked CEO Lee Scott where the tipping point in terms of changing consumer behavior. His answer was an interesting one. Scott said it was undeniable that Wal-Marts core customers were the first ones impacted by the spike in gasoline prices and they bought less. What changed? Scott said two things: (1) Wal-Mart improved its store experience (cleaned up aisles, added brands to its merchandise and refocused on retail) and (2) the economic stress spread from the bottom up and brought in new customers at the right time (i.e. After Wal-Mart improved stores.) Scott said that this trend doesnt mean that business will fall off when the economy improves. Wal-Mart executives also made it clear that theyre interested in expanding health care and green initiatives. In other words, theyre trying to anticipate where product trends are headed and carve out a low cost niche to feed developing needs.
Paul Singer: Cushion to withstand risks is very low#Paul Singer thinks the recent dramatic move in the Swiss  franc—and resulting losses—shows just how exposed most  investors are to market risk.Given the pricing and the still opaque and over-levered financial system, the sensitivity ... to risks is extremely high ... and the cushion  to withstand risks is very low, the founder of Elliott Management said at the World Economic  Forum in Davos, Switzerland, on Wednesday.
Media Companies, Seeing Profit Slip, Push Into Education#As another academic year starts, about 500,000 children across the country will find themselves learning subjects like middle school history or high school biology from a new line of digital textbooks. These manuals, branded Techbooks, come with all the Internet frills: video, virtual labs, downloadable content.But the Techbook may be most notable for what it does not have — backing from a traditional educational publisher. Instead it has the support of Discovery, the cable TV company.
Retailer Grows Up, Along With His Business#34-year-old professional skier Bryce Phillips had a vision to create a retail experience for the active sport enthusiast that would embrace their lifestyle and their values.In 2005, he launched Evo, an online and brick-and-mortar retail business that caters to skiers and boarders. Retail is just one part of the business. He also engages the community through events such as art openings, film premieres, and skate competitions at the Seattle headquarters. Evo, short for “evolution”, is how Phillips thinks about his business: always changing to stay relevant. And indeed, his company evolved from a one-man business selling merchandise from liquidators at the age of 12, to a full-fledged business with 120 employees.Phillips talks about how Evo got its start,why it has thrived, and where he plans on taking the company from here.
