Stocks End Slightly Higher; Earnings Little Help#Stocks closed slightly higher as a mostly positive start to earnings season was offset by the air quickly coming out of a rally in bank stocks.Financials surged Monday following a bullish call from noted analyst Meredith Whitney, but the sector was the markets biggest drag on Tuesday even though Goldman Sachs reported earnings that blew past Wall Streets expectations.Investors were wary after economic data showed larger-than-expected gains in producer prices and retail sales—but both readings came largely on the backs of auto and energy sales. With the two volatile areas stripped out, the numbers reflected anemic consumer growth that has been exacerbated by rising unemployment.The economic reports triggered expectations of inflation, and at least some of the late-morning pop in stocks was attributed to short-covering.
Huawei CEO says its working on 6G — but the#Huawei has begun research on 6G — the successor to 5G mobile networks which are not yet widespread, according to its CEO Ren Zhengfei.5G is the name of next-generation mobile networks that promises super-fast data speeds and the ability to underpin new technologies like driverless cars. These networks are slowly rolling out in places such as South Korea, the U.K. and soon China. However, they are not yet available on a large scale.However, Huaweis founder Ren is already talking about 6G.
US Stocks Seen Higher, Boosted by Bernanke Speech#U.S. stock index futures signaled a marginally higher open on  Thursday, with European and Asian shares boosted after Federal  Reserve Chairman Ben Bernanke reiterated his support for  ultra-easy monetary policy on Wednesday.    In his second day of testimony on Capitol Hill on Wednesday,  Bernanke said loose monetary policy was boosting  employment.    We believe the monetary policies we have conducted have helped  get stronger recovery and more jobs than we otherwise would have  had, he said, according to Reuters.    Bernanke forecast it would take three more years for unemployment  to decline to 6 percent, further diminishing concerns the Fed  might tighten policy sooner than expected. Previously, Bernanke  has said he will keep interest rates low until unemployment falls  to around 6.5 percent.    U.S. gains may be capped however by uncertainty about whether a  last-minute deal can be struck to avert the $85 billion of  spending cuts, known as the sequester, due to hit on  Friday.    In his testimony, Bernanke warned Congress of the dangers of  failing to reach an agreement on how to combat  sequestration.    I think there is some cost to the economy of these repeated, I  wont say crises, but these repeated episodes where Congress is  unable to come to some agreement and therefore some automatic  thing kicks in. I think that is on the whole not a good thing for  confidence, Bernanke said on Wednesday, according to  Reuters.   Meanwhile, a heavy day for economic releases will get underway  with the governments release of its latest estimate of fourth  quarter Gross Domestic Product (GDP) at 8:30 a.m. New York time.  Economists polled by Reuters forecast a sharp rise on the  previous estimate, to 0.5 percent annualized growth, after the  previous forecast suggested GDP declined by 0.1 percent in the  fourth quarter.    This upward revision is likely to be a result of both exports  and consumption being higher than previously thought, wrote Paul  Dales, a U.S. economist at independent research firm Capital  Economics, in a note on Wednesday afternoon.    Whats more, despite the expiry of the payroll tax cut in  January, the early evidence suggests that GDP growth accelerated  in the first quarter of this year.   Hopes for upbeat first quarter growth figures were boosted by  Wednesdays release of durable goods data for January from the  Commerce Department. Core orders, excluding transportation,  posted their biggest gain since December 2011, rising 1.9 percent  month-on-month.    In a note on Wednesday, Peter Newland, a U.S. economist at  Barclays, said that taking into account the durable goods data  numbers, he forecast 1.3 percent growth in the first  quarter.    Other economic data out on Thursday includes the Labor  Departments weekly initial jobless claims at 8:30 a.m.  Economists polled by Reuters forecast there were 360,000 new  claims in the week ending February 23, down from 362,000 in the  previous week.   The Chicago Purchasing Managers Index (PMI) of manufacturing  activity is due at 9:45 a.m. Analysts polled by Reuters predict a  reading of 54.3 for February, down from 55.6 percent last month.  PMI index readings above 50 signal an increase or improvement on  the prior month, while readings below 50 indicate a decrease.   Also, the Energy Department will issue its weekly look at natural  gas inventories across the U.S. at 10:30 a.m. on Thursday.  Inventories fell by 127 billion cubic feet in the prior week.   On the corporate front, Thursday will be a busy day for retail  earnings, with Best Buy, Kohls, and Barnes & Noble posting  results before the start of U.S. trade.    Barnes & Nobles results will be eyed with interest after  stakeholder Liberty Media said on Wednesday that it had the power  to block a sale of the bookseller, and is waiting to hear if  Barnes & Noble Chairman Leonard Riggio will make an  offer.    Sears Holdings reported forecast-beating earnings for the fourth  quarter early on Thursday.   Groupon shares will also be watched, after the discount voucher  provider lost a quarter of its market value on Wednesday when it  revealed it had started taking a smaller commission on deals  during the holidays, in order to retain merchants.    - By CNBCs Katy Barnato
Israels Offshore Gas — Bonanza or Security Threat?#The Middle East, source of much of the world’s hydrocarbons, is one of the most volatile regions on earth, where energy issues impact international relations. From Iraqi oil output, still struggling to reach its 2003 pre-invasion levels through Iran’s sanctioned nuclear program, the region focuses the world’s attention like nowhere else.
Netflix earnings: Street looks for signs of global traction#The media industrys current mantra is content is king but for  analysts watching Netflix this week, subscribers are  king — more specifically international subscribers.   When Netflix reports third-quarter results Wednesday evening,  its expected to post a 43 percent decline in earnings per share,  while sales are forecast to rise 24 percent, but the real story  about the state of its global expansion.   The streaming giant has laid down roots in hosts of new markets, most  recently Japan in the third quarter, and it plans to expand  further into Europe during the fourth quarter. Wall Street will  undoubtedly be looking for signs that the expansion is gaining  traction.   Analyst are bullish on second-half subscriber growth and the  company is widely expected to surpass its guidance  of 3.55 million net additions — consisting of 2.4 million  additional international subscribers and an additional 1.15  million domestically.
Downturn in China Spreads to Key Sectors#China’s downturn is spreading to the sectors and companies that were expected to withstand the slowdown and drive growth in the region.
US urges judge to deny Huawei motion in government effort#U.S. prosecutors on Monday asked a judge to reject a motion by Chinas Huawei seeking information on the grounds for a government request to disqualify the companys lead defense lawyer in a criminal case alleging bank fraud and sanctions violations.    Last month, prosecutors argued Huawei lawyer James Coles prior position as the No. 2 official in the U.S. Department of Justice created conflicts of interest that necessitated his removal.    The prosecutors said Cole, who served as deputy attorney general (DAG) until 2015, represented the government in a related investigation, without disclosing details. Huawei asked the court to review overbroad redactions in the U.S. motion seeking his removal.    Huawei wants prosecutors to reveal the very information it is trying to prevent the new client from learning, the prosecutors said in a letter to Judge Ann Donnelly in U.S. District Court in Brooklyn, New York.   The conflict presented here is unprecedented, the prosecutors argued. The government was not aware of any other senior DOJ official who had sought to represent a client that had been part of his government work, let alone when the former representation involved classified information, they said.    A spokesman for Huawei Technologies, the worlds largest telecommunications equipment maker, declined to comment, and Cole did not respond to a request for comment. Cole entered a not guilty plea on behalf of Huawei in March.
The 15 best medical schools in the US, according to#Each year, U.S. News & World Report ranks the best medical schools in the country based on variables such as peer assessments, amount of National Institutes of Health (NIH) research grants funds awarded and faculty-to-student ratio.This year, the top-ranked schools include prestigious private institutions as well as public universities. The list also makes clear just how hard it is to get into medical school today — 13 of the top 15 medical schools admit less than 6 percent of applicants.Medical schools set up a great number of hoops for applicants to jump through: a prescribed undergraduate curriculum with numerous prerequisites, the MCAT exam, a complex and multi-part application, traveling to interviews, exhaustive days interviewing and a constant requirement for professionalism throughout, Dr. McGreggor Crowley, an admissions counselor at admissions consulting firm IvyWise, tells U.S. News. Here are the 15 best medical schools — and what it takes to get in — according to U.S. News:
March Lows Will Hold — So Buy Equities: Strategists#Doug MacKay of Broadleaf Partners and Bill Spiropoulos of Corestates Capital Advisors agree: The March bottom will hold — and you want to be in equities now.
Early movers: AMZN, CLX, AN, HSY, F, AMGN & more#Check out which companies are making headlines before the bell:   — The online retail giant reported quarterly profit of $1.54 per share, 19 cents a share above estimates. Amazons revenue came in below Street forecasts, however, and the company also gave weaker-than-expected current-quarter revenue guidance.  — The household products maker reported adjusted quarterly earnings of $1.25 per share, 3 cents a share above estimates. Revenue was very slightly below forecasts. Clorox also cut its full-year 2017 outlook, although the company said its core business remains strong.  — The car retailer earned an adjusted 95 cents per share for its latest quarter, a penny a share below Street forecasts. Revenue was slightly below consensus estimates, but AutoNation posted record earnings for both the fourth quarter and for all of 2016.  — The chocolate maker beat estimates by 9 cents a share, with adjusted quarterly profit of $1.17 per share. Revenue was slightly below forecasts. Sales were higher compared to a year earlier, with strengthening demand in the United States.  — The automakers stock was upgraded to overweight from equal weight at Barclays, which said Ford is better positioned than its competitors to withstand a potential border tax.  — Amgen came in 10 cents above estimates, with adjusted quarterly profit of $2.89 per share. The biotech companys revenue also beat Street forecasts. Amgens full-year earnings and revenue guidance came in below Street forecasts, however. Additionally, Amgen announced positive results for a study involving its cholesterol drug Repatha, saying it reduced the risk of heart attacks, strokes, and death in a study of patients with heart disease.  — Visa reported quarterly profit of 86 cents per share, 8 cents a share above estimates. Revenue also beat forecasts. Visas results were helped by strong payment volume growth, as well as more cross-border transactions.  — Chipotle fell 2 cents short of Wall Street forecasts with quarterly earnings of 55 cents per share, while the restaurant operators revenue was essentially in line. Chipotle did see sales rise for the first time in five quarters, but comparable store sales were down 4.8 percent.  — GoPro beat Street estimates by 7 cents a share, with adjusted quarterly profit of 29 cents per share. The high-definition camera makers revenue fell short, as well. GoPro also gave weaker-than-expected profit margin guidance for the current quarter.  — Deckers reported adjusted quarterly profit of $4.11 per share, shy of the consensus $4.24 estimate. The footwear makers revenue also fell short, as does the Uggs makers 2017 full year guidance.  — FireEye lost an adjusted 3 cents per share for its latest quarter, smaller than the 16 cent loss expected by analysts. The cybersecurity software makers revenue fell short of Street forecasts, as does its current quarter revenue outlook. The company also said its chairman and chief financial officer would leave the company.  — Tableau doubled estimates with adjusted quarterly profit of 26 cents per share, and the business software maker also saw revenue exceed estimates.  — The company fell 5 cents a share short of consensus forecast, with adjusted quarterly profit of 53 cents per share. The underwear makers revenue also fell short of estimates. The company also gave worse than expected full-year guidance for 2017, despite seeing an improvement in profit margins and international sales.  — Lockheed denied a report that it sought help from former Donald Trump campaign manager Corey Lewandowski in navigating a dispute with the president over the cost of its F-35 fighter jet.  — Square senior executive Francoise Brougher is resigning from the mobile payments company today after four years of leading the companys sales and marketing efforts. Brougher will be replaced by Square chief marketing officer Kevin Burke.
The Word On GM, J. Crew & Airline Puts#Go behind the headlines and get the latest word on todays hot trades  -- this kind of info comes straight from buyers and sellers on the trading floor. You wont find straight talk like this, anywhere else.ALL EYES ON TOMORROWS PPI:The news: The markets moving Producer Price Index or PPI number is released tomorrow morning. The word: Eric Bolling says PPI doesn’t matter. CPI on Friday is more important.GM SPUTTERS TO PROFIT: The news: Shares of General Motors (GM) fall despite the fact that the automaker is reporting the largest quarterly profit in more than 2 years.The word: Jeff Macke says GM made money selling cars! This could be a turn around story and they might be one to watch, maybe.LEHMAN BROTHERS GRIMM: The news: Lehman shares fall as much as 5.5% despite Lehman reporting a record quarterly profit.The word: Guy Adami says Goldman Sachs (GS) beat EPS earnings by 36% yesterday and Lehman (LEH) beats it by a penny, yet they both trade with a 9.5 multiple. It makes no sense to him, though Guy says it’s neither an indictment of LEH or an endorsement of GS.H&R BLUES: The news: H&R Block (HRB) hits a 4-year low as sub-prime crisis worsens quarterly loss.The word: Tim Strazzini says their Options One mortgage business lost $50 million dollars and they’ve’ set aside another $100 million– with management doing everything they can to get this under control. Tim says the smart trade is selling puts out into April or June or buying the stock although it’s going to be flat for a while.OILS STEADY FLOW: The news: At a meeting tomorrow, OPEC is expected to announce current output levels will remain unchangedThe word: Eric Bolling says it doesn’t matter. That’s priced into the market already.J. CREW LOOKING GOOD? The news: J. Crew (JCG) shares fall despite better-than-expected earningsThe word: Jeff Macke says J Crew has high inventory. He likes the name but says give it time before buying, don’t jump in tomorrow.AMR ROUGH LANDING? The news: AMR Put Buying Picks Up The word: Guy Adami says traders are buying $30 puts (a bet the stock will go down) with the stock trading at $31.25. (That might be because last summer the airlines got crushed although Guy isn’t worried about that, yet.)  However, Guys admits he will be keeping a close eye on the put buying in the sector.
Oppenheimer says 3Q revenue hurt by economic news#NEW YORK -- Oppenheimer Holdings Inc. reported Friday that its third-quarter net income rose 10 percent, as lower expenses helped make the best of flat revenue.Albert Lowenthal, CEO of the New York investment firm, said that while the economy remains uncertain, the U.S. equity markets have continued to perform remarkably well. But he said a consistent drumbeat of negative economic news has held down investor activity and the companys revenue during the period.Oppenheimer reported net income of $2.3 million, or 17 cents per share, for the quarter that ended Sept. 30. Thats up from $2.1 million, or 15 cents per share, earned in the 2011 third quarter.Revenue was basically flat at $231.8 million, compared with $231.6 million last year.Oppenheimer also said Friday that its board declared a quarterly cash dividend of 11 cents. The dividend is payable on Nov. 23 to shareholders of record as of Nov. 9.Shares increased 14 cents to $15.21 by midday. Its shares remain in the middle of its $12.47 to $19.69 52-week trading range.
Easy money has been made with Apple: Analyst#Whats Apple really worth? At more than $700 billion, Apple is currently the worlds most valuable company. Activist investor Carl Icahn sees its worth even more. Based on Icahns share valuation that he made in February, Apple would be a $1.3 trillion company.Morningstar senior analyst Brian Colello disagrees. You get cannibalization, I think you see the iPhone growing really well but the iPad is not and so if the Watch grows really well, maybe iPhone growth slows. I think you have a more stable revenue base but for the growth to get to a trillion, I think it would be difficult, Im not seeing that, Colello told CNBC on Wednesday.
Video Game Sales Get off to Slow Start in 2011#2011 isnt looking much better than 2010 or 2009 for retail sales of video games.
Britain intervenes in Nvidias $40 billion Arm takeover on national#LONDON — The U.K. government has intervened in Nvidias proposed $40 billion takeover of chip designer Arm on national security grounds.Britains Digital Secretary Oliver Dowden issued a Public Interest Intervention Notice (PIIN) on Monday. Its not clear what the national security grounds are but the Department for Digital, Culture, Media and Sport said Dowden considered advice received from officials across the investment security community.Dowden said he has written to the U.K. competition watchdog and asked them to start a phase one investigation into the transaction, which was announced in September.The Competition and Markets Authority has been instructed to compile a report for Dowden on the competition and national security aspects of the deal before July 30. Dowden could then approve the deal, permit it on certain conditions, or ask for a more detailed inquiry.Following careful consideration of the proposed takeover of Arm, I have today issued an intervention notice on national security grounds, said Dowden in a statement. As a next step and to help me gather the relevant information, the U.K.s independent competition authority will now prepare a report on the implications of the transaction, which will help inform any further decisions.
Merrill Taps Thain After Fink Demanded Full Tally#Merrill Lynchsdecision to name John Thain as its new chief executive came after the firms first choice, BlackRock CEO Larry Fink, demanded that Merrill make a full accounting of its subprime exposure, CNBC has learned.
CDC reverses indoor mask policy, saying fully vaccinated people and#The Centers for Disease Control and Prevention recommended Tuesday that fully vaccinated people begin wearing masks indoors again in places with high Covid-19 transmission rates. The agency is also recommending kids wear masks in schools this fall.Federal health officials still believe fully vaccinated individuals represent a very small amount of transmission. Still, some vaccinated people could be carrying higher levels of the virus than previously understood and potentially transmit it to others.This pandemic continues to pose a serious threat to the health of all Americans, CDC Director Rochelle Walensky told reporters on a call. Today, we have new science related to the delta variant that requires us to update the guidance regarding what you can do when you are fully vaccinated.The updated guidance comes ahead of the fall season, when the highly contagious delta variant is expected to cause another surge in new coronavirus cases and many large employers plan to bring workers back to the office. In mid-May, the CDC said fully vaccinated people didnt need to wear masks in most settings, whether indoors or outdoors.In areas with substantial and high transmission, CDC recommends fully vaccinated people wear masks in public, indoor settings to help prevent the spread of the delta variant, and protect others. This includes schools, Walensky said. The CDC recommends that everyone in grade schools wear masks indoors, including teachers, staff, students and visitors, regardless of vaccination status.Walensky said new data shows the variant behaves uniquely differently from past strains of the virus, indicating that some vaccinated people infected with the delta variant may be contagious and spread the virus to others.Read More: Americans will need masks indoors as U.S. heads for dangerous fall with surge in delta Covid casesHealth experts fear delta, already the dominant form of the disease in the U.S., is hitting states with low vaccination rates. Those states are now being forced to reintroduce mask rules, capacity limits and other public health measures that theyve largely rolled back in recent months.Read CNBCs latest global coverage of the Covid pandemic:FDA authorizes Pfizers Covid vaccine for kids ages 5 to 11 South Korea loosens restrictions in first step toward living with Covid-19  Florida sues Biden over contractor Covid vaccine mandateGlobal Covid cases and deaths rise for the first time in two months, WHO says Some 5% of unvaccinated adults quit their jobs over Covid vaccine mandates, survey shows
Insurers choose their partners. So how big will the dance#Aetna  and Humana have announced a $35 billion  cash and stock agreement to merge, one day after Centene indicated it  planned to buy its Medicaid-focused rival Healthnet for $6.8  billion.   Should Anthem and Cigna eventually reach a deal to combine their  businesses, it will mark one of the most significant eras of  consolidation in the history of the health insurance  sector. Yet the question remains whether regulators will embrace  the deals as quickly as these rivals have embraced one another.  Four of the largest U.S. insurers will combine to form two health-care powerhouses, and the competition may spur more mergers among  smaller players. The effect is going to be very specific to markets, said  Christopher Koller, the president of the Milbank Memorial Fund, a  health policy research foundation that advises states. Read MoreWhat the [Federal Trade Commission] will want to determine  is, does an insurer have a big enough market share in a  particular market so as to eliminate or reduce competition,  asked Koller, who served as Rhode Islands health insurance  commissioner from 2006-2013.  Still, Koller argues that when it comes to insurance the bar has  been set fairly high by federal regulators.  I regulated a  market where a domestic, local, non-profit (Blue Cross plan) had  60-70 percent of market share. And I certainly didnt have the  FTC marching in there trying to take it apart, he said.  Yet current Rhode Island Health Insurance Commissioner Kathleen  Hittner said these new large insurer deals should be carefully  scrutinized because it could hurt the burgeoning consumer  market.  People want consolidation for efficiency, which is what  (insurers) promote, said Hittner. If you have competition, they  look at the other plans and they try to have similar plans, she  said.  I think if you take away that competition, we will see higher  rates and we will see less ability for the states to adjust those  rates, she added.
